id	status	idea	category	impact	evidence	notes
mla-02	pending	Multi-Latent Attention (MLA): low-rank KV compression via latent bottleneck, reduces VRAM allowing larger batch or model	architecture	medium	DeepSeek-V2/V3 paper; 93% KV cache reduction; multiple open-source implementations available	Compresses K,V through shared low-rank latent. Frees VRAM headroom. Main benefit is inference but training VRAM savings could allow batch_size=8 or deeper model.
normuon-04	pending	NorMuon: normalize Muon update by applying norm step to attention params at stacked shape before reshape	optimizer	low	modded-nanogpt PR#144 (-15 steps/-0.7s WR); note: "adding negligible value to gates and attention" per discussion	Small change to Muon step. Low risk, low reward. Try after architecture changes.
qknorm-temp-08	pending	Learnable attention temperature: add per-layer scalar to scale QK dot product (exp(temp) * base_scale). QKnorm makes attention too diffuse.	architecture	high	nanochat autoresearch found QKnorm scaler multiplier was missing - attention was too diffuse. One of ~20 additive improvements.	Simple change: one scalar per layer, init 0 (no change). Directly addresses known issue. Could sharpen attention where needed.
ve-wd-09	pending	Value embeddings weight decay: add WD specifically to value_emb while keeping WD=0 for everything else	training dynamics	medium	nanochat autoresearch found 'Value Embeddings really like regularization and none was being applied'. We have WD=0 globally.	Low risk. Only adds WD to one param group. Follows nanochat finding. VE may overfit while main model benefits from no WD.
adam-betas-10	pending	Tune AdamW betas for embedding/head groups: try (0.9, 0.95) or (0.85, 0.99) instead of current (0.8, 0.95)	optimizer	low	nanochat autoresearch found 'AdamW betas were all messed up'. Current (0.8, 0.95) may not be optimal.	320 experiments were run just to tune beta1 in modded-nanogpt. High sensitivity suggests room for improvement.
